{
  "$schema": "https://json-schema.org/draft/2020-12/schema",
  "$id": "https://beatless.local/schemas/state.schema.json",
  "title": "TaskOSState",
  "type": "object",
  "additionalProperties": false,
  "required": [
    "job_id",
    "status",
    "current_stage",
    "current_iteration",
    "created_at",
    "updated_at",
    "retry_count",
    "circuit_breaker",
    "stage_history"
  ],
  "properties": {
    "job_id": {
      "type": "string"
    },
    "status": {
      "type": "string",
      "enum": [
        "queued",
        "planned",
        "implementing",
        "verifying",
        "reviewing",
        "blocked",
        "escalated",
        "rolled_back",
        "done"
      ]
    },
    "current_stage": {
      "type": "string"
    },
    "current_iteration": {
      "type": "integer",
      "minimum": 0
    },
    "created_at": {
      "type": "string",
      "format": "date-time"
    },
    "updated_at": {
      "type": "string",
      "format": "date-time"
    },
    "wall_clock_elapsed_min": {
      "type": "integer",
      "minimum": 0
    },
    "retry_count": {
      "type": "integer",
      "minimum": 0
    },
    "circuit_breaker": {
      "type": "object",
      "additionalProperties": false,
      "required": [
        "consecutive_no_diff",
        "consecutive_same_error",
        "state"
      ],
      "properties": {
        "consecutive_no_diff": {
          "type": "integer",
          "minimum": 0
        },
        "consecutive_same_error": {
          "type": "integer",
          "minimum": 0
        },
        "state": {
          "type": "string",
          "enum": [
            "closed",
            "half_open",
            "open"
          ]
        }
      }
    },
    "stage_history": {
      "type": "array",
      "items": {
        "type": "object",
        "required": [
          "stage",
          "status",
          "at"
        ],
        "properties": {
          "stage": {
            "type": "string"
          },
          "status": {
            "type": "string"
          },
          "at": {
            "type": "string",
            "format": "date-time"
          }
        },
        "additionalProperties": true
      }
    },
    "last_checkpoint": {
      "type": "object",
      "additionalProperties": true
    },
    "failure_log": {
      "type": "array",
      "items": {
        "type": "string"
      }
    }
  }
}
