{
  "job_id": "smoke-1775546213",
  "status": "done",
  "current_stage": "done",
  "current_iteration": 5,
  "created_at": "2026-04-07T07:16:53+00:00",
  "updated_at": "2026-04-07T07:16:53+00:00",
  "wall_clock_elapsed_min": 0,
  "retry_count": 0,
  "circuit_breaker": {
    "consecutive_no_diff": 0,
    "consecutive_same_error": 0,
    "state": "closed"
  },
  "stage_history": [
    {
      "stage": "planned",
      "status": "completed",
      "at": "2026-04-07T07:16:53+00:00"
    },
    {
      "stage": "implementing",
      "status": "completed",
      "at": "2026-04-07T07:16:53+00:00"
    },
    {
      "stage": "verifying",
      "status": "completed",
      "at": "2026-04-07T07:16:53+00:00"
    },
    {
      "stage": "reviewing",
      "status": "completed",
      "at": "2026-04-07T07:16:53+00:00"
    },
    {
      "stage": "done",
      "status": "completed",
      "at": "2026-04-07T07:16:53+00:00"
    }
  ],
  "last_checkpoint": {
    "verify_fail_count": 0,
    "last_error_fp": "",
    "last_error_msg": "",
    "iteration": 5,
    "stage": "done",
    "summary_ref": "iteration/5/summary.json"
  },
  "failure_log": []
}
